id,question,answer
1,What is canine parvovirus?,"Canine parvovirus is a highly contagious and potentially deadly virus that primarily affects dogs, especially unvaccinated puppies between 6 weeks and 6 months old. It targets rapidly dividing cells, particularly in the intestinal tract, bone marrow, and lymphoid tissues. The virus leads to severe gastrointestinal signs such as profuse vomiting and bloody diarrhea, causing rapid fluid loss, dehydration, and potentially fatal complications like sepsis or shock. Early recognition and prompt treatment significantly improve the chances of recovery."
2,What causes parvoviral enteritis in dogs?,"The primary cause of parvoviral enteritis is canine parvovirus type 2 (CPV-2), a small, non-enveloped DNA virus. This virus selectively infects cells that divide rapidly, which includes the cells lining the intestinal wall, immune cells in the bone marrow, and lymphoid tissues. Infection results in intestinal inflammation, immune suppression, and the characteristic clinical signs of parvovirus. CPV-2 has several variants, including CPV-2a, 2b, and 2c, with varying prevalence across regions."
3,How do dogs get infected with parvovirus?,"Canine parvovirus is transmitted primarily via the fecal-oral route. Dogs contract the virus by ingesting infected feces or coming into contact with contaminated surfaces, such as kennels, bedding, bowls, shoes, or human hands. The virus is incredibly hardy and resistant to many disinfectants, enabling it to persist in the environment—particularly in cool, moist conditions—for up to a year or more. This long survival period underscores the importance of stringent sanitation protocols in preventing spread."
4,What are the main symptoms of parvovirus?,"The clinical presentation of parvovirus in dogs includes a sudden onset of severe gastrointestinal signs such as persistent vomiting and foul-smelling, often bloody, diarrhea. Affected dogs frequently experience lethargy, anorexia, fever or sometimes hypothermia, and signs of abdominal discomfort. Rapid fluid loss from vomiting and diarrhea leads to dehydration and electrolyte imbalances. In advanced cases, the disease may progress to sepsis, collapse, and even death, especially if left untreated."
5,How soon do symptoms appear after exposure?,"Following exposure to canine parvovirus, the incubation period usually ranges between 3 to 7 days. This is the period during which the virus is replicating inside the body but before visible symptoms emerge. The exact duration can vary depending on factors like the viral dose, the dog’s immune system strength, age, and whether it has been partially vaccinated. Some dogs may begin shedding the virus in their feces even before they show clinical signs, which further facilitates its rapid spread."
6,How is parvovirus diagnosed?,"Parvovirus is diagnosed using clinical signs and tests like fecal ELISA antigen tests, PCR, or bloodwork showing low white blood cell counts."
7,What does a CBC show in a parvovirus case?,"A complete blood count often shows leukopenia, anemia, and hemoconcentration due to dehydration."
8,Is parvovirus contagious to other dogs?,"Yes, parvovirus is extremely contagious among dogs and spreads through contaminated feces and surfaces."
9,Can parvovirus be transmitted through clothes or shoes?,"Yes, the virus can be carried on clothing, shoes, hands, or equipment and infect healthy dogs."
10,What dogs are most at risk of parvovirus?,"Puppies between 6 weeks and 6 months, unvaccinated dogs, and those in crowded or unsanitary conditions are at highest risk."
11,Can adult dogs get parvo?,"Yes, though it's more common and severe in puppies, adult dogs can also contract the virus, especially if unvaccinated."
12,Can cats get parvovirus from dogs?,"No, cats have their own version called feline panleukopenia virus. Canine parvovirus does not infect cats."
13,What is the treatment for parvovirus?,"There is no cure for parvovirus, so treatment involves supportive care like IV fluids, antiemetics, antibiotics, and close monitoring."
14,Can parvovirus be treated at home?,Home treatment is risky. Veterinary hospitalization is recommended due to the severity of the illness.
15,What is the survival rate for parvovirus?,"With prompt treatment, survival can exceed 80–90%. Without treatment, the mortality rate is very high."
16,Can dogs recover from parvovirus?,"Yes, many dogs recover fully with proper treatment, though recovery may take days to weeks."
17,Do recovered dogs become immune?,"Most dogs develop long-term or lifelong immunity after recovering, but vaccination is still important."
18,Can vaccinated dogs still get parvovirus?,"It’s rare but possible, especially if vaccination was incomplete or the immune response was poor."
19,How can parvovirus be prevented?,"Vaccination, good hygiene, isolation of infected dogs, and proper sanitation are key to prevention."
20,What type of vaccine protects against parvovirus?,"Modified live vaccines are used, often included in DHPP combination vaccines."
21,When should puppies be vaccinated for parvo?,"Puppies should receive their first vaccine at 6–8 weeks, with boosters every 3–4 weeks until 16–20 weeks."
22,Can older dogs be vaccinated?,"Yes, adult dogs should receive a booster one year after the initial puppy series, then every 1–3 years."
23,How long does parvovirus live in the environment?,"Parvovirus can survive in the environment for up to a year, especially in cool and moist areas."
24,What disinfectants kill parvovirus?,"Effective options include bleach diluted 1:30, accelerated hydrogen peroxide, and veterinary disinfectants like potassium peroxymonosulfate."
25,How long does a dog shed the virus?,Infected dogs can shed the virus for up to 10 days after recovery.
26,What should I do if I suspect my dog has parvo?,Seek veterinary attention immediately. Delaying treatment can significantly reduce survival chances.
27,Is parvovirus a zoonotic disease?,"No, canine parvovirus does not infect humans."
28,Can parvovirus cause neurological signs?,"It primarily affects the gut and immune system, but rare neurological symptoms can occur due to complications."
29,How is parvo controlled in animal shelters?,"Strict isolation, routine disinfection, intake vaccination, and protective gear are essential control measures."
30,Can dogs get parvo twice?,"Reinfection is rare, but not impossible. Full vaccination remains important."
31,How long does recovery from parvovirus take?,"Most dogs recover within 5–10 days, though full recovery may take longer depending on severity."
32,Is parvo painful for dogs?,"Yes, the condition can be very painful due to vomiting, diarrhea, and abdominal discomfort."
33,What is the cost of parvo treatment?,"Treatment costs can range from $500 to $2,000 or more, depending on severity and location."
34,Can parvovirus affect the heart?,"In rare cases, especially in very young puppies, it can cause myocarditis (inflammation of the heart)."
35,How effective is the parvovirus vaccine?,The vaccine is highly effective when the full series is completed.
36,What are the side effects of the parvo vaccine?,"Side effects are usually mild and include soreness, lethargy, or mild fever."
37,Can parvovirus live on grass or soil?,"Yes, the virus can persist in outdoor areas like soil or grass for many months."
38,Can parvovirus infect wild animals?,"It mainly affects domestic dogs, though some wild canids like foxes and coyotes may be susceptible."
39,Is there a rapid test for parvovirus?,"Yes, in-clinic ELISA snap tests provide quick results from a fecal sample."
40,What supportive care is given for parvo?,"Supportive care includes IV fluids, electrolytes, anti-nausea medications, antibiotics, and sometimes plasma transfusions."
41,Can probiotics help in parvo recovery?,"Yes, probiotics may help restore gut flora and improve recovery, but only under veterinary guidance."
42,Is parvovirus fatal?,"Without treatment, it is often fatal, especially in young or immunocompromised dogs."
43,What organs does parvovirus affect?,"It mainly targets the gastrointestinal tract, bone marrow, and lymphoid tissues."
44,Does parvo affect a dog's long-term health?,"Most dogs recover completely, but some may have lingering digestive issues."
45,Can a dog with parvo drink water?,"They may try, but often vomit it back. IV fluids are typically needed."
46,Is parvovirus common?,"Yes, it's one of the most common and serious viral diseases in dogs worldwide."
47,Can humans carry the virus to dogs?,"Humans can't get infected, but they can carry the virus on hands, clothes, or shoes."
48,How do I disinfect my home after a parvo case?,"Clean all surfaces with bleach (1:30), wash bedding in hot water, and avoid bringing new dogs into the area for several months."
49,Should I isolate my dog if it has parvo?,Absolutely. Isolation prevents the spread to other dogs and protects vulnerable animals.
